,Company,Title,TitlePoints,TopComment,Sentiment,TopCommentPoints
256,BitNami,BitNami (YC W13) Launches App Store for Server Software,51,People laughed at Dropbox because Coda/rsync/Subversion already existed.,1.0,14
257,BlockScore,BlockScore (YC S14) Lands $2M In Funding For Making I.D. Verification Easier,31,Does this have anything to do with bitcoin/block chain?,0,4
260,Browsarity,Browsarity (YC W10) Allows You To Donate Affiliate Fees To Charity,48,"While I did make and launch <a href=""http://browseforacause.com"" rel=""nofollow"">http://browseforacause.com</a> a few months ago (which this may or may not have been inspired from), I welcome this launching - any innovation to donate more money to charity can really only be a good thing.",2.0,20
262,Bushido,Bushido (YC S11): An App Store For The Web That Can Kickstart Your Side Projects,118," No, you can't set your pricing to capture all of the theoretical value that your product creates.  Otherwise it's a wash.  Also, there's friction in any system, so you not only have to create value (that I get to keep), but do so enough to justify the switching costs.<p> No, not unless you have no competitors.  And if you have a generic solution to lower support costs by 10%, if you don't have competitors now, you will soon.<p>No, software pricing isn't rational.  Oh, how I wish it were at times.    But in general, unless you're an amazing salesman, your prices have to be at a level that to the customer feel ""about right"".",0.714285714286,9
263,Cambly,Cambly (YC W14) Offers On-Demand Access To Language Tutors,26,LiveMocha isn't in YC and won't have to pivot in a few months due to a poorly thought-out business model.,3.0,3
264,Camperoo,"Camperoo (YC W14) Helps Parents Find and Book Summer Camps, Activities for Kids",61,"Just a friendly reminder for parents to not turn a blind eye to anything that goes on at camp.  For example, bullying.  Teach your child strategies for dealing with it and keep a close emotional attunement. This is a PSA for parents who actually care and don't just use camp as a glorified babysitting service.",0.25,4
265,Can'tWait,IPhone App Helps You Discover Upcoming Movies (YCS11),45,"I'm worried about the apparent disconnect between my brain and the world of web startups or maybe even simply the world. I think YC numbers are proof enough that startups like this can become popular and commercial successes.<p>Yet as someone who likes movies and watches a lot of them it's completely beyond me how something like this could ever be more than a minor feature of some movie site, one that is trivial to copy for anyone in the space with the advantage of an existing user base.<p>I have no reason whatsoever to trash this startup, quite the contrary, I'm in a completely different space and I wish only the best to any and all fellow startup founders. I'm just honestly puzzled, fully aware that it's probably me who is going to be wrong again.<p>I'm just wondering if anyone else is struggling to convince themselves to take something as simple as this and run with it in a crowded market. Even if I had the slightest interest in solving this problem, I just couldn't bring myself to believe in it and that might be why I will very likely never strike it rich.",0.388888888889,11
267,Carlypso,Carlypso (YC S14) could change everything about how we buy and sell used cars,65,Sam Walton visited Montgomery Ward and decided to copy the model. That's the Walmart story.,0,10
269,Casetext,Casetext (YC S13): New Angle on Legal Research With Wikipedia-Style Annotations,64,"J/J: I'm a deal lawyer, so I rarely look at caselaw. But regs. and statutes are my bread and butter. Any thoughts about how you would approach annotating these kinds of materials?<p>There's of course an interesting version control problem when statutes get amended--how do you merge your annotations which are anchored to the old text into the new text?",0.0,2
270,Caviar,Square Acquires Food Delivery Service Caviar (YC S11),79,Congrats to the Caviar team! My wife broke her leg two months ago and Caviar was a lifesaver to help us avoid the boredom and monotony of pizza and Chinese food every night.,1.2,6
272,Checkr,1000Memories (YC S10): The Internet Adds New Dimension to Grieving Process,38,"I don't like the emphasis these companies place on ""forever"".  To me, the tragic part about death on the internet is how confusing and muddled the <i>event</i> of death is.  We leave behind aliases and loose ends in several different communities.  We die in the middle of a rapidly accelerating digital life process.<p>Facebook et al. will have to develop serious policies of death eventually.  Someday a third of their users will be dead-- someday the <i>majority</i> of Facebook users may be dead.  I think there's space for a web service that lets you compose your last words on these platforms, to be delivered programmatically through APIs and other means in the event of your death.  Last emails, submissions, status updates, etc.  A ""Goodbye World"" script, so to speak.  To depart deliberately, gracefully (or maybe, explosively!) from our many virtual lives.",-1.81818181818,4
274,Circular,AnyLeaf (YC S10)  Putting an End to the Old Supermarket Circular,53,"I would actually use this. I'd love you if you suggested recipes based on what's on sale nearby.<p>Nit: you're not available in my area (27605), and you made me enter my email to find that out. If this wasn't a YC company I was curious about, I would have bounced.",2.0,9
276,Clerky,Clerky (YC S11) Helps Startups Save Time And Money On Legal Incorporation,6,"We partner with Incorp, one of the largest registered agent service providers in the US (the other two are CSC and CT).  Let us know if you have any other questions!",0,1
278,Clickpass,Bringing OpenID To The Masses: Clickpass (YC summer 07),92,"We are on Disqus, news.yc and plaxo at the moment.<p>If you want to skip the intermediate pages, <a href=""http://disqus.com/login"" rel=""nofollow"">http://disqus.com/login</a> and <a href=""https://www.plaxo.com/signin"" rel=""nofollow"">https://www.plaxo.com/signin</a> :)",1.0,9
280,CO2Stats,Never noticed News.YC's CO2Stats before.  How do they compute this stuff anyway?,26,"Smoke, mirrors, reading of dead chicken entrails...<p>You know, the usual PT Barnum stuff to impress the rubes.<p>Interesting paragraph from their site:  ""CO2Stats reserves the right to cap REC purchases in case of excessive use, as its own discretion.""<p>That is, you could pay them $100 a month and they may or may not purchase offsets to cover your 5 million page views.",-0.333333333333,24
282,CodeCombat,CodeCombat (YC W14) Wants You To Learn To Code By Playing Games,28,"> I've done quite a bit on Codecademy, and I get it, but there are still a lot of things I am just ignorant of, like where you actually type code (what's a good source code editor?) and so on.<p>I've noticed a lot of tech resources (tutorials, guides, manuals) routinely fail to explain basic, foundational concepts that are required for a beginner to understand what they are doing. And it drives me effing crazy.",-0.2,4
283,CodeNow,Meteor campaign to unlock $25k for CodeNow (YC W14 nonprofit),25,"Hi, I'm running this campaign.<p>I'd say you should only star the project if you genuinely like Meteor enough to star it.<p>If you're still on the fence about Meteor but like the cause, I'd encourage you to donate directly to CodeNow at codenow.org.",2.0,6
284,Coderwall,Coderwall (YC W12) Wants to be the Reputation System for Developers,71,"I don't want another website/web-app (GitHub, StackOverflow, place-with-karma-where-cool-kids-hangout) where I have to prove myself again and again.<p>Especially not when the website has more controls than I am.<p>Especially knowing that it is better to use my free time to make a business than showcase my skill (unless you're a contractor/consultant).",1.33333333333,14
285,Collections,Collections (YC S12) is remaking the most basic part of the OS: The Finder,40,"OS X has become ""the OS"" now?",0,7
288,Crowdery,Crowdery (YC S13) Provides A/B Testing for a Brands Physical Products,69,"I feel like this could end up creating, in effect, a Pandora for clothing and physical products. With the data they are collecting alomg with previous purchasing behaviors this could really give a product like The Fancy a run for its money.",2.0,2
289,Cruise,"For $10,000, your car can drive itself  Cruise (YC W14)",216,"This reminds me of a Kickstarter campaign I saw a few months ago. The campaign's goal was to build low-cost bouncing balls that cleared mine fields. You could roll the ball into a dangerous, abandoned area and it would cause dormant mines to explode.<p>The problem with that campaign is that it instilled a false sense of confidence. The technology was ""an in-between"": certainly better than nothing, but not as effective or safe as traditional mine-clearing methods.<p>Cruise is in a similar position. They have a chance to improve people's lives and prevent serious injuries. At the same time, they're toeing a delicate line between improving drivers' safety and causing them to become complacent.",0.615384615385,28
290,Cryptoseal,CryptoSeal (YC S11) Shutting Down Private VPN,198,"I was just trying to sign in to my account, as I was greeted with this:<p>""<i>CryptoSeal Privacy Consumer VPN service terminated with immediate effect</i><p>With immediate effect as of this notice, CryptoSeal Privacy, our consumer VPN service, is terminated.  All cryptographic keys used in the operation of the service have been zerofilled, and while no logs were produced (by design) during operation of the service, all records created incidental to the operation of the service have been deleted to the best of our ability.<p>Essentially, the service was created and operated under a certain understanding of current US law, and that understanding may not currently be valid.  As we are a US company and comply fully with US law, but wish to protect the privacy of our users, it is impossible for us to continue offering the CryptoSeal Privacy consumer VPN product.<p>Specifically, the Lavabit case, with filings released by Kevin Poulsen of Wired.com (<a href=""https://www.documentcloud.org/documents/801182-redacted-pleadings-exhibits-1-23.html"" rel=""nofollow"">https://www.documentcloud.org/documents/801182-redacted-plea...</a>) reveals a Government theory that if a pen register order is made on a provider, and the provider's systems do not readily facilitate full monitoring of pen register information and delivery to the Government in realtime, the Government can compel production of cryptographic keys via a warrant to support a government-provided pen trap device.  Our system does not support recording any of the information commonly requested in a pen register order, and it would be technically infeasible for us to add this in a prompt manner.  The consequence, being forced to turn over cryptographic keys to our entire system on the strength of a pen register order, is unreasonable in our opinion, and likely unconstitutional, but until this matter is settled, we are unable to proceed with our service.<p>We encourage anyone interested in this issue to support Ladar Levison and Lavabit in their ongoing legal battle.  Donations can be made at <a href=""https://rally.org/lavabit"" rel=""nofollow"">https://rally.org/lavabit</a>  We believe Lavabit is an excellent test case for this issue.<p>We are actively investigating alternative technical ways to provide a consumer privacy VPN service in the future, in compliance with the law (even the Government's current interpretation of pen register orders and compelled key disclosure) without compromising user privacy, but do not have an estimated release date at this time.<p>To our affected users: we are sincerely sorry for any inconvenience.  For any users with positive account balances at the time of this action, we will provide 1 year subscriptions to a non-US VPN service of mutual selection, as well as a refund of your service balance, and free service for 1 year if/when we relaunch a
consumer privacy VPN service.  Thank you for your support, and we hope this will ease the inconvenience of our service terminating.<p>For anyone operating a VPN, mail, or other communications provider in the US, we believe it would be prudent to evaluate whether a pen register order could be used to compel you to divulge SSL keys protecting message contents, and if so, to take appropriate action.""",0.967741935484,36
291,Cube,Cube (YC W12) Goes Deeper Than Your Standard iPad Register,41,Does that qualify as trademark infringement?  I can definitely see the case for customers being confused by the similarity to Square.<p>edit:  Can someone please explain why this is being downvoted?  I'd like to make sure my contributions are constructive.,0.333333333333,7
293,DataNitro,DataNitro (YC S12) launches Python for Microsoft Excel,69,"I remember being so excited about this product that I sent a msg to the IronSpread team thanking them for their work, even though I hadn't even used their product yet. (I'd never done that before for any product)<p>It's great to see this taking off (and I had no idea it was part of YC until now), and am looking forward to future updates!<p>Best of luck to the team :)",2.0,4
294,Dealupa,Former Googlers Launch Delupa (YC W12): A PageRank For Daily Deals,42,"You know what: Fuck all these apps that are simply telling me the most interesting thing to spend my money on which is horrid consumerism.<p>You know what I NEED:<p>An app that does this but for investment: I set a budget per month; it tells me the best thing to invest it in - and takes a small % of the return.<p>Open up how to MAKE money, not spend it.<p>In all of Groupon's life i have bought exactly ONE deal from that. I make well over 100K and have no interest in wasting my money on ""deals""",-0.166666666667,5
295,DebtEye,Debteye (YC S11) Wants To Be Your (Much Cheaper) Credit Counselor,92,"<i>This part made me skeptical (wouldn't a professional debt consultant be better at negotiating good terms than your average layman?).</i><p>If you assume the debt consulting is working for the debtor, then yes, it would be reasonable to assume they would be better at negotiating terms than the average layman.  There is a very dangerous assumption in this sentence.<p>If you ever have a credit related problem, and are considering talking to a credit counselor, jump into a vat of pond scum.  There, I just saved you several thousand dollars, and you'll feel cleaner in the bargain.<p>(Serious advice: you will get better advice from either a lawyer or the Motley Fool Credit Cards and Consumer Debt forum than from credit counselors.)",0.133333333333,22
297,Diaspora,Diasporas (YC S12) Next Act: Social Remixing Site Makr.io,96,This is exactly what the internet needs less of. Sad to see the diaspora guys reduced to overlaying unfunny text captions over jpgs.,-2.0,58
300,Doblet,Doblet (YC S14) Plans to Be Everywhere Your Phone Charger Isn't,6,awesome,4.0,1
302,Draft,Draft (YC S11) Is The Best Word Processor You Can Write With Today,61,"The ""ask a professional"" feature is really cool. A couple of years ago some MIT students came out with a plugin for Word called Soylent [1]. It's the same basic idea, except it's backed by Mechanical Turk instead of a team of professional editors. Turkers suggest small changes and the changes are voted in or out of the final draft by other turkers. Pretty cool stuff.<p>[1] <a href=""http://projects.csail.mit.edu/soylent/"" rel=""nofollow"">http://projects.csail.mit.edu/soylent/</a>",1.0,4
304,Dreamforge,Dreamforge (YC S12): Make your own superhero,53,I was sad to discover there was no way to create a female superhero. The editorial in the newspaper page (homepage) mentions a female but she is only the ex-girlfriend and a <i>fashion</i> blogger. Disappointing.,-1.66666666667,11
305,Easel,Easel (YC S12) launches as an easier way to design for the web in your browser,80,"I've gotta agree on this one. Generally all I can think when I use browser-based design tools is how much faster/easier it would be for me to go into Photoshop or better, the code itself.<p>I think the biggest flaw in these apps is they start people with either an amateur design or a blank template instead of exposing the grids and guides that define a website (and further define the limitations of web design) right off the bat. Even though it starts as a blank page, I love Alex Maccaw's Stylo (<a href=""http://styloapp.com/"" rel=""nofollow"">http://styloapp.com/</a>) because the tools are simple and familiar, they don't overburden the page I'm focusing on and it creates smart guides that show up when I've got two elements on the same plane. It's the only one of these apps I've tried that actually extends my creativity and doesn't end up taking me longer to design something I like between clunky UI elements or trying to figure out what everything does.",1.28571428571,5
308,Errplane,Errplane (YC W13) launches performance monitoring and alert service,89,"The basic site is in Ruby and Rails, but the API, which handles all the high volume stuff, is written in Go. So far it's fantastic. I'm actually giving a talk at Bacon in London in April on my experience building this in Go vs. Scala or Node: <a href=""http://devslovebacon.com/conferences/bacon-2013/talks/why-node-and-scala-will-dry-up-go-will-drink-their-milkshake"" rel=""nofollow"">http://devslovebacon.com/conferences/bacon-2013/talks/why-no...</a>",4.0,9
309,Eventjoy,Eventjoy (YC W14) Is A One-Stop Shop For Organizing Events,45,"Ridejoy, Pathjoy, Homejoy, Eventjoy. There's something about YC and a certain suffix...",1.0,9
310,EveryArt,With EveryArt (YC W12) you don't have to be afraid of commissioning art ,171,"Easy access to spectacular concept art through EveryArt would be a big win for smaller game developers.  Great concept art really helps bridge the gap from ""pretty cool"" to ""amazing"" and amplifies the inspiration driving the game concept.<p>Having worked on the early production stage of Blizzard's next MMO, concept art definitely seems like the most fun part of the design process, for both the artists <i>and</i> those who commission them.  With concept art work, you can find mind-bogglingly talented people who, when you give them ideas and let them roam free, will do these face-meltingly awesome concepts that inspire you so much you just want to make huge posters of them and jump inside.<p>People just get so excited hiring amazing artists and seeing what they can do with few limits in place.  That's what EveryArt will really have going for it.<p>BTW, is there's anyone who has taken on commission markets for musical groups?  Been wondering for a while: <a href=""http://www.quora.com/Is-there-a-service-that-allows-people-anywhere-to-commission-a-band-or-musician-to-cover-a-song"" rel=""nofollow"">http://www.quora.com/Is-there-a-service-that-allows-people-a...</a>",2.125,15
311,Everyday.me,"Everyday.me (YC S12) - an ""Evernote for Your Life""",72,">> Why is it so difficult for people to describe their new service? Alternatively, why am I so bad at understanding?<p>Because it's a solution to a problem that doesn't exist.",-1.25,11
313,Fabricly,Fabricly (YC W10) launches threadless for fashion and raises money,57,"Oh, we're not ignoring brand name at all. Our first mini-collection is by a relatively established upcoming British label that only has very limited exposure in the US. We have exclusive collections from several other labels coming up. Small labels can find themselves in very precarious financial positions as they try to grow, even after many ""successful"" seasons. Fabricly is about providing a very low risk route to putting out a collection. Almost like a book publishing model for fashion.",0.25,8
315,FanHero,FanHero (YC S13) Helps YouTubers Sell Branded Merch To Their Fans,36,Congrats Kevin and Charlie! Awesome idea,3.0,4
318,Fivetran,Fivetran (YC W13) launches spreadsheet for data analysis ,63,"Why do I need to give Fivetran access to my google accounts to try out their product?  Eg, why can't I just enter my email account and click on the confirmation email for identity confirmation like every other service?<p>From the google page:<p><pre><code>  Fivetran is requesting permission to:\n    View basic information about your account\n    View your email address\n</code></pre>\nI don't know what 'View basic information about your account' means, but No Thanks.",1.0,4
321,Flynn,Flynn Beta (YC S14),150,> It's entirely unclear how to use Flynn<p>I'll go a step further: it's unclear _what_ Flynn is. I read the homepage and was still confused.,-1.33333333333,31
322,Flypad,Flypad (YC W12) Wants To Turn Your iPhone Into A Steering Wheel,44,"I would much much much rather have a way to get my Xbox controller to talk to my iPhone.<p>Many games are designed well to take into account the touchscreen, but games that present virtual thumbsticks are usually problematic.",0,5
325,Fuzzwich,Summer YC: Fuzzwich Politics Cartoon builder,16,Steve is a bison? Or is that a buffalo?,0,4
328,Gbatteries,"Gbatteries (YC W14) Launches BatteryBox, A 50Whr Backup Battery For MacBooks",244,"Here is a classic example of a startup launching an Altair Basic with the potential produce a Microsoft-like giant.  Incidentally, I think this is also the first father/son team we've funded.",0,69
329,Giftrocket,GiftRocket (YC W11) Lets You Send Gifts That Can Be Redeemed At Any Location,59,So I pay a company 5% for the privilege of sending my friend blocks away so I can put money in his paypal account?,-1.0,11
332,Glassmap,Glassmap (YC S11) Launches A Better Find My Friends,63,"Deriding Foursquare as ""low tech"" reminds me of Balmer bragging about how you could use Zune's wifi to share a song with a girl and Steve Jobs suggesting you just give her one ear bud.",-0.5,7
334,GoComm,"GoComm (YC S13) Takes On Yammer Mobile For Task Management, Event Coordination",34,"It's a no-brainer for anybody that's been in the event management space. The problem is you're so bogged down in running the events you don't have time to take a step back and innovate - which is probably true of most industries.<p>Great team and awesome product, excited to see where they go!",1.6,1
338,Grid,Grid (YC S12) Reinvents The Spreadsheet For The Tablet Age,184,"I asked a straightforward question about whether an app that can't be used to create a spreadsheet should be considered a spreadsheet app, and because of that I ""represent one of the worst forces at work in the world."" I neither ridiculed nor made fun of Grid, as you claim I did; however, you seem to take pleasure in ridiculing and making fun of me. I'm sorry that I didn't heap the app with praise -- from the video I saw, it does look like an impressive beginning. Perhaps if I had, my question would have been met with an answer without such disrespect.",1.44444444444,99
339,Grove,"Convore (YCW11) is reborn as Grove.io, a chat service for businesses",110,"""I already run my own UnrealIRC daemon, on Linode, for $20/mo with however many users it can handle.""<p>Then I would argue you're not the target market. I'm a tech company CEO. I have WAY better things to do than set up an IRC server, even though my background is Linux system administration. My employees (we have 8 people currently; hiring #9) also have better things to do (like, you know, features our customers want :)<p>So we use Hipchat. And Hipchat rocks. Everyone on our team loves it. (We actually tried grove first, but it just wasn't mature enough for our needs--Hipchat has Mac OS, Windows, web, Android, AND iPhone apps, and we're all on different platforms, so that works out well.)<p>When you're paying developers $$$, you don't want them to be setting up IRC servers. Better to use a Hipchat or a Grove.io and be up and running in 5 minutes with clients on every device. For us, it's well worth the few $ a month to have one less thing to set up and maintain.",1.71428571429,11
340,Hackermeter,Pinterest Acquires Hackermeter (YC S13),56,"What a mean-spirited thing to say, and to upvote.  It makes me sad to see this kind of snark as the top comment on HN threads.",0.666666666667,24
341,HackPad,Dropbox acquires Hackpad (YC W12),228,"Just a little side note.  I really wish people would give an overview of what their service is or does in press releases like this.  Quite often, I see 'Facebook bought x' or 'Dropbox bought y' and I click to see what it is, and if I would want to use it.  More often than not, there's no little blurb that lets me know what their product even does.",0.75,67
343,HauteDay,"HauteDay (YC S14), A Gamified Shopping Site",14,"I skimmed the article, clicked through to <a href=""http://hauteday.com"" rel=""nofollow"">http://hauteday.com</a>, and shrugged. It wasn't until I read the About Us page that I got why this is actually interesting. Seriously guys, if you're reading this, your current tag line doesn't work. Right now it says:<p><pre><code>    Each day our community votes on the hautest\n    new finds in fashion.\n</code></pre>\nAnd instead it should say:<p><pre><code>    Find the hautest new clothes, and we'll buy them for you.\n</code></pre>\nI'm really, really confused about why you're burying the lede. I'm also grimacing at the use of the non-word ""hautest"".<p>Rule 1 of any website: your greatest competitor is the back button. If you can't sell a visitor on what you're offering almost immediately, you're going to lose them.<p>Rule 2: It's not about you, it's about <i>me</i>. No one cares about your community. People care about getting free shit (and winning), especially if that free shit is a free pair of Adriano Goldschmied skinny jeans.<p>I'd <i>love</i> a free pair of AG jeans. So let me know when you launch this for men ;)",0.166666666667,3
