,Company,Title,TitlePoints,TopComment,Sentiment,TopCommentPoints
516,Terascore,Terascore (YC W13) launches to help teachers bring testing online,10,"Hi balazs,<p>> demo.terascore.com is up and has not been down<p>Last time I went some assets were not loading -- it could have been a problem on my side. Now it works great.<p>more feedback:<p>The contenteditable work is very nice. I see what you mean by ""enabling _all_ educators"": WYSIWYG definitely makes a difference here.<p>The tooltips that pupup all over the place are annoying. OK, for reproducing MSWord-like editing in the browser but don't reproduce the paper clip!<p>The recourse to tooltips sounds to me like you are having trouble phrasing the key value proposition. You should think of your MVP and just //show it// without too much explaining. The ""what you do"" steps should be obvious from the visual hierarch of the website.<p>I would suggest the following changes. 
At Top Level s/Tests/My tests/ and s/Students/My students/ 
as for Educators, it doesn't seem like it belongs at the top level. 
Your users mostly be coming to create exams and check their students' grades.<p>On the exam admin view, say
<a href=""https://demo.terascore.com/assessment/cc54852a50a54a499e833377e77f5fc7/content"" rel=""nofollow"">https://demo.terascore.com/assessment/cc54852a50a54a499e8333...</a> ,
there should be more visual demaraction for each question. The exam is a list of questions. Make that visible in the hierarchy. One approach would be to have a list of the questions on the left (like a table of contents) and move 
all the question authoring stuff out of there. Maybe you could have the authoring toolbar that appears on the right of the question currently being edited.  Such a ""right margin panel"" could also contain all the questions metadata instead of that cramped row Type|*|POINTS|TAGS.<p>Ok now I should probably go and get some work done but I just wanted to say that you have built an excellent tool and I like where you are going with this, EXCEPT the part where you assign the student's grade based on the z-score. That is BS and you know it. What information does my ranking  relative to the other students in my class convey?<p>I encourage you to focus more on the ""Reporting: Immediate self-assessment, Students can access their own score reports"" aspect of this  and then come up with a effort based metric for the ""Grades in Score Report ADJUST GRADING"" part. Forget  and , instead you could report ""cpu usage"" during the last (week, month, year). I wrote some more about this not too long ago <a href=""http://minireference.com/blog/exams-suck/"" rel=""nofollow"">http://minireference.com/blog/exams-suck/</a>",1.14285714286,1
517,TerrAvion,TerrAvion (YC W14) Launches Aerial Imagery As A Service For Farmers,45,"As you know, I didn't kill those posts because they're about a YC company.  I killed them because HN is a news site, not a support forum for YC companies.  And the reason we don't want that sort of post is not to conceal problems with YC cos, but because (as we saw) this sort of indignation-inducing fluff is so easy to upvote that it will take over a site if you allow it.<p>It is a super lame move to try to hijack a thread about a newly launched startup to get attention for some unrelated grievance.  You wouldn't like if it someone did that to you.",0.0909090909091,12
520,Theorem,Theorem (YC S14) aims to be the Priceline for fashion,35,"I'm guessing they're going to get a C&D on their name before too long: <a href=""http://en.wikipedia.org/wiki/Theory_(clothing_retailer)"" rel=""nofollow"">http://en.wikipedia.org/wiki/Theory_(clothing_retailer)</a>",0,4
523,Thread,ASK PG/HN: Questions before interview for S11 batch,15,"1. Since we show you all the paperwork in advance, the only thing you don't know before I call is how much stock we'll ask for.  Usually groups can decide about that on the fly, or even in advance.  So most people either tell me yes or no when I call them, or call back a few minutes later.  But we don't have any deadline for replying, so if groups have some reason they need more time to decide, we always give it to them.  E.g. there was once a startup that we offered to fund that got an acquisition offer that weekend.  They needed weeks to see if the acquisition was going to happen.  (It did.)<p>2. It wasn't DST but the Start Fund, which is a separate thing. I believe those guys are going to invest again, but I can't promise anything, because it's not for me to promise.  A lot of people don't realize this, but YC was not a party to that deal.  It was just between Start Fund and the individual startups.  (We were in favor of it, certainly, but we didn't have any agreements with anyone.)<p>3. In years past I caved a few times when people tried to negotiate with me, but I haven't recently.  I realized I was just doing it out of fatigue at the end of a long day of interviews.  I've also learned from experience that there is near zero correlation between groups' tendency to negotiate and how well they end up doing.  In fact come to think of it, possibly an inverse correlation.  So it's easy to say no.",0.25,23
524,Threadable,"Threadable (YC W14) makes mailing lists more awesome, less noisy",103,"Thanks, neilk. People say they hate email, but we see that as an indicator of its utility: ""I hate this but use it everyday"" sounds like an opportunity for improvement. As Elie Wiesel said, ""the opposite of love is not hate, it's indifference.""",0.0,11
525,TicketLabs,TicketLabs (YC S14) Helps Small Music Venues Get More Fans Through the Door,60,"Love the idea but not entirely sold on the name.  Have you guys considered ""TicketMoose""?",3.0,4
526,TicketStumbler,"Ticketstumbler (YC summer 08) ""growing 50 percent a month""",45,"I actually didn't want this article submitted so I flagged it. Kidding, kidding. There are, however, some out of context quotes and a ridiculous looking picture (the photographer was nice, but quirky). Oh well, I <3 press.<p><i>To clarify:</i><p>-We've never said that we'll never take money. In an ideal situation, startups would not have to take money and if we can get away with it great, if not that's okay. We're well aware that the odds are against us on this one.<p>-We've been very open with this with our potential investors. The sharp money is still investing in this economy and luckily some of them are still interested in us. You think a VC will argue with you when you say you want more months of operational information so you can make a better informed, data-driven decision? Nada. I've talked to four potential investors this week alone.<p>-Due to the economy, sales have stayed relatively flat as average sales have gone down while volume has gone up. However, we're still working out bugs and have over $1 billion worth of tickets on the site. Most people don't even know we have concert tickets yet, which is by design. We'll be chasing more PR soon, which will hopefully lead to real salaries for myself and Tom.<p>-We don't have a model, a deck, a pitch book or executive summary. We'll make them on demand if they are ever needed. If you want to do it right, it's a very time consuming process. In the short term we thought it was a better use of our time to talk to our users (I respond to literally every non-form letter email), create content, develop and sell.<p>-Obviously models can reflect growth rates. My point was: when you are growing quickly in the early stages, by the time you get to the final boardroom meeting, everything can very easily be out of date. This is especially true when you haven't spent any money on advertising.<p>-Month over month traffic is up 67% as of today. This is largely due to Obama Tickets, more pages being indexed, SEO and good ol Google.<p>-I haven't had a haircut since I quit my job. \m/<p>Edit: Of course as I write this our contact page is down. We're on it.<p>Edit 2: It's back up.",1.33333333333,11
530,Toutpost,Toutpost (YC S13) Wants To Turn Online Debates Into Shopping Advice,54,">Turn Online Debates Into Shopping Advice<p>When I read the headline, I imagined a service that crawled forums and discussion boards and used NLP to determine useful shopping advice.<p>If that happened, all those non-slept nights spent battling people who were wrong on the Internet would finally pay off. (<a href=""http://xkcd.com/386/"" rel=""nofollow"">http://xkcd.com/386/</a>)",-0.333333333333,4
531,Tracks.by,Hipset (YC S12) Shows You The Music Content Facebook's Been Hiding,40,The article shows a fundamental misunderstanding how Facebook filtering works. If Facebook didn't have any kind of filtering on page updates then they'd flood out friend updates which are much more important.<p>The likelihood that a particular fanpage update will get filtered out for an individual user is dependent on how the user has interacted with the fanpage in the past. If a user frequently clicks through/comments/etc on updates from a fanpage then updates from that fanpage are far less likely to get filtered out.<p>The whole sponsored stories thing was introduced a long time after Facebook had started doing filtering.<p>Saying that the filtering is a conspiracy to help Facebook make money may well be libelous.,-0.166666666667,9
532,TradeBlock,"TradeBlock (YC W14) Raises $2.8 Million From Andreessen Horowitz, Others",17,"For those that have been around the Bitcoin community for a while these guys used to be called ""The Genisis Block""",0,4
533,TrueVault,TrueVault (YC W14) Brings Easy HIPAA Compliance to Startups and Health Apps,52,"I'm the technical co-founder of a startup[0] that stores patient data, and I know a couple of people who are working on what they call ""Heroku for HIPAA-compliant applications"" (slightly different from what TrueVault is, though it serves a similar consumer base)[1].<p>When I first heard about this and started building our application, I was surprised nobody has tackled this space before. Building HIPAA-compliant applications on AWS is a lot easier[2] than most people think, but it's a <i>huge</i> pain.<p>More importantly, it's the <i>same</i> huge pain for almost everyone who goes through the process, and in a way that's rather easy to ""factor out"".<p>In that regard, it's not that different from HR or payroll services, which startups almost never do in-house (once they are larger than a few employees, and until they get to be fairly large).<p>It looks like we're a bit beyond the stage where TrueVault would make sense for us, but I'm glad that this space is starting to attract attention. Technical founders should spend their limited time on building amazing technology and amazing products, not duplicating the same compliance work that everyone else has had to go through.<p>[0] <a href=""https://www.boardrounds.com/"" rel=""nofollow"">https://www.boardrounds.com/</a><p>[1] The company is Aptible: <a href=""https://www.aptible.com/"" rel=""nofollow"">https://www.aptible.com/</a> (We aren't customers of these folks, though we like their product)<p>[2] None of it would be too technically difficult for most of the people reading HN - it's more the diligence of checking boxes, writing up policy docs, etc. It's <i>important</i> to do it right, but it's generally a matter of time (and money) more than anything else.",1.0,6
534,Tuxebo,Ask HN: What would you ask YC founders?,16,What was your lowest low and how did you deal with it?,-1.0,3
537,uBiome,UBiome (YC S14) Raises $4.5M to Crowdsource Microbiome Research,26,"Isn't there a close relationship between the human microbiome and the local environmental microbiome?<p>If so, wouldn't the data be more meaningful if local soil, air, and water samples were also included; or is that just too complex?",2.0,2
538,Unbabel,Unbabel (YC W14) Launches A Human-Edited Machine Translation Service,39,"Hi, I am Joao the CTO of Unbabel. That is definitely something  that is on our roadmap while we improve our mt systems. We have very useful data to build better mt systems and hence improve the overall system.",2.0,4
539,UPower,UPower (YC S14) Is Building Nuclear Batteries,188,"I am one of the UPower founders.  The key takeaways here are that the main hindrances to novel nuclear are (1) meeting regulatory and safety necessities without huge testing costs, which also require a customer interested in purchasing, and (2) competing with the grid, (3) huge scientific/technical risks if not yet proven.<p>UPower meets these by\n(1) being small enough to build a very tough, full scale emulator for testing, never before done in nuclear.\n(2) not competing on the grid, which gives immediate, in need customers which is also necessary for regulatory process to complete in (1).\n(3) using technologies and materials with decades of experience, in a new way, eliminating the huge uncertainties of many startups you see in the news.",0.857142857143,31
541,Userfox,Show HN: Userfox (YC S11)  Better Welcome Emails ,95,"we built <i>a lot</i> of stuff for userfox over the past few months. and we were looking at it all, making sure the user interface was usable, and so on: and ultimately decided that actually: sending emails <i>when a user signs up</i> is one of the most valuable inflection points, because:<p>a) it applies to <i>every</i> user (= highest ROI on copy written)<p>b) first impressions matter!<p>and c) its minimal work / thought for our customers. maximum value.<p>so we decided screw it! lets ship something this week! this month! and here we are. lets do one thing really well.<p>so userfox today allows you to send a drip sequence of emails to your new users. you can choose the days, the subjects, the content, we support your custom email theme, we even show you clicks and conversions, and so on.<p>it's <i>awesome</i> because its so light and easy. we're going to roll out some awesome custom data features very shortly. dead simple things, like simply ""send this welcome email unless a user is on a paid plan.""<p>et voila. when i look at products, i look at what they require me to do, and what they give me in return. i think that userfox can move the needle on your business, and to do that we ask for literally 15 or 30 minutes of your time. i'd bet you'll see more impact from userfox than your sophisticated SEO strategy in fact.<p>i have been on hacker news for a long time: it maybe even helped me get into ycombinator! but these are all stories for another day: right now, i wanted to show hacker news our product, because i think if you're a bootstrapping business: userfox is a no brainer. ""it just works.""",1.125,5
542,Vatler,Vatler (YC S14) wants to be your on-demand valet,23,"thank you @sargun for the brilliant analysis. I am Vatler co-founder. The reason why we start with the office use-case is essentially because we can predict the demand, break deals with garages nearby and build our network of valet at low cost. Next step is the anywhere, anytime use-case. It's going to be huge :)",1.5,4
543,Vidpresso,Vidpresso (YC W14) Offers Low-Cost Tools for Adding Tweets and Ads to Broadcasts,27,"Our hacker news story is crazy too. Back when I posted this:<p><a href=""https://news.ycombinator.com/item?id=6993981"" rel=""nofollow"">https://news.ycombinator.com/item?id=6993981</a><p>Our life looked a lot different. It's insane how much can change in a few weeks. We've also found some really good folks as references from HN... so if you're into video and like coding... we should be friends! :)<p>More on our mission here:<p><a href=""http://vidpresso.com/blog/secret-vidpresso-master-plan"" rel=""nofollow"">http://vidpresso.com/blog/secret-vidpresso-master-plan</a>",0.25,4
544,View3,Voluntary List of YC W11 Submissions,77,"Enter your Info: <a href=""https://spreadsheets.google.com/viewform?formkey=dFZkT2QxZXFFRWlYUWoyUG4zRVBIZGc6MQ"" rel=""nofollow"">https://spreadsheets.google.com/viewform?formkey=dFZkT2QxZXF...</a><p>View the Results: <a href=""https://spreadsheets.google.com/pub?key=0Ataf_IejHzNydFZkT2QxZXFFRWlYUWoyUG4zRVBIZGc&output=html"" rel=""nofollow"">https://spreadsheets.google.com/pub?key=0Ataf_IejHzNydFZkT2Q...</a><p>This is the harder-to-troll version, which i'll be posting on HN shortly.",0,10
545,VirtualMin,Virtualmin - YC startup in Venturebeat,27,"VA is the most promising startup of all YC companies I've heard of, if you ask me. Under-hyped and over-delivering.",0,5
547,VoiceGem,VoiceGem (YC S12) Brings Communication Back To The Future,69,"I love these guys. Started using VoiceGem in beta a few weeks ago and can't stop. I am now using this with my family, who often try to reach me with no luck. The benefits are obvious - you don't have to respond to voice calls. There's an expectation on the sender's end that you will respond, eventually, but you can be in control of your time. Unlike a regular voicemail, this also allows you not to talk to the other party in real time, thus delivering your message to them, but on your time. Seriously, just try it, you'll fall in love with the app.",1.42857142857,5
548,Walksource,Walksource (YC S14) helps hotels solve relocations,12,"While getting ""walked"" is the short story, you could flatten this out to other overbooked rentals like automobiles. If you can set up a system that is efficient enough to allow a company to overbook without worrying about hurting customer satisfaction I imagine there is a lot of money to be made.",-0.5,1
549,Watchsend,Watchsend (YC S13) records mobile screen interactions for user testing,67,"Cofounder here. We're a service that helps app developers understand their users in order to make their apps better. Like almost any other service that collects and stores data, it's possible to intentionally misuse Watchsend in ways that grossly violate users' privacy.<p>What we mean by ""we take privacy seriously"" is that we work really hard to make sure that devs who care about their users' privacy can use Watchsend to make their apps better without infringing on their users' privacy. At the end of the day, if a developer wants to spy on their users, there's very little we (or anyone else) can do about it.",1.0,4
550,Weave,Weave (YC S14) Adds Groups and Events to Its Tinder For Networking App,39,"I just tried the android app.  The way the ui is laid out, I think I swiped the wrong way a bunch of times.  Not obvious if I am swiping to the right. Or from the right...",-2.0,3
551,Weilos,Weilos (YC S13) Wants To Pair You With An Online Weight Loss Coach ,58,"Hey everyone, I'm Ray, one of the founders of Weilos. We just got started, but early signals are promising with active users making significant progress on the site. Very excited about this opportunity to help a lot of people! Would love to hear what everyone thinks.",2.0,6
552,WhereBerry,WhereBerry (YC W11): A Social Network for Making Future Plans,69,"We tried solving this problem in 2007 with the ""plans"" functionality in the first iteration of Localist. It's definitely a tough nut to crack, as a website/app will never beat the convenience/accessibility of email.<p>Here's the biggest issue we ran into, which I'm not sure WhereBerry has solved either:<p>Let's say Julie wants to see Fast Five (ugh), and she wants to know which of her friends would like to attend. At first, she considers using WhereBerry, as it's designed for such things. But wait, Julie's friend Joe doesn't have an iPhone. And I know her other friend Steve doesn't use social networking sites besides Facebook. Julie resolves to just send an email out to everyone, so she knows she'll get a response from everyone she wants to talk to in one step. Plus, she already has everyone's email address.<p>See the problem? Julie is forced to isolate her non-WhereBerry friends, or invite some on WhereBerry, and others via email (huge inconvenience). This isn't solving the problem. It's compounding it. Let's say WhereBerry tries to ""solve"" this problem by allowing Julie to invite non-members via email. We tried that, too. While it sounds good on paper, nobody wants to send their friends an email saying ""Hey I want to go to this movie. Join WhereBerry to tell me your response!"" In reality, they'll probably text Julie saying ""Sure, I can go! Why didn't you just text me?""<p>It doesn't matter if 95% of your friends are signed up to WhereBerry. You'd need 100% to get people to use it in any consistent form.<p>It's not a tough problem to discover, as many products have attempted to solve it. But, no company has succeeded, specifically because of the scenario posed above. I wish WhereBerry luck, but I think it needs to solve the problem before being a ""cool plan-making utility."" There are millions of those.",0.409090909091,13
553,Whereoscope,Whereoscope (YC S10) Gives Parents An Easy Way To Track Where Their Kids Are,56,Growing up with cellphones was bad enough. Kids need their space. Whereoscope has made the lives of lots of kids slightly worse.,-1.66666666667,20
555,WireOver,Protect Yourself From The NSA With WireOvers (YC W12) Encrypted File Sharing,57,"Closed source, no thanks. I'm going to follow their approach of ""trust no one"" and not trust them and warmly recommend everyone to do the same. If you actually mind about security, use GPG.",0.6,20
556,Wit.ai,Wit.ai (YC W14) Wants To Be The Twilio For Natural Language,98,"Their documentation has a pretty clear endpoint for sending raw audio: <a href=""https://wit.ai/docs/api#toc_9"" rel=""nofollow"">https://wit.ai/docs/api#toc_9</a>",1.0,7
557,Workflowy,WorkFlowy (YC S10) launches a better way to organize your brain,171,"Annoyance from the homepage:  I don't want to have to watch a video to figure out what you do.  Watching a video for me is one step of engagement after I've figured out if I have some basic interest.  If I can't establish that immediately, I'll just close the window.  Videos can be great for more in depth info, but why not use the space taken up by ""A better way to think"" (which says nothing) to give a one-line description of what it the product <i>is</i>?",1.0,50
559,Wufoo,Wufoo (YC W06) integrates Notifo (YC W10) for form notifications,55,"For lack of a better word, this YC ""synergy"" is a HUGE competitive advantage for YC startups. Rock on.",1.0,13
561,Yardsale,Local Marketplace App Yardsale (YC S11) Launches Nationwide,81,"Ok, I am fine with the need of something better than ebay and craiglist but would someone explain me why does it have to be a mobile app? why? i think that this services need to reach the larger audice they can. Making it an app does not do that..it is limiting IMHO. Why I, android and PC owner, should be excluded? i understand you will (maybe?) make it available in future for other platform even porting it to android cuts out all those people who want to do things on the PC, which is the biggest part of the userbase I think.",1.0,11
563,YouOS,Ask YC: Would you rather work from home or live in office?,6,"I'd always recommend an apartment for a small startup with little money.  Even if you don't live in it, I'd recommend getting an apartment as an office.  Apartments are cheaper and nicer to work in.  The only advantages of offices are that the can hold more people (not an issue for a young startup) and that they seem more professional.  But having a good product is more important than seeming professional, and you're more likely to get one if you work in a good place.",2.33333333333,10
565,Zen99,"Zen99 (YC S14) Makes Life Easier for Freelancers with Finance, Insurance Tools",36,"In this case I think it's meant to rhyme with ""1099"" like the IRS form.",2.0,6
566,Zenamins,Zenamins (YC S14) Mails You Personalized Vitamins,17,Aren't vitamins pretty much useless if you don't have any deficiencies?,-0.5,10
568,Zenter,Voluntary List of YC W11 Submissions,77,"Enter your Info: <a href=""https://spreadsheets.google.com/viewform?formkey=dFZkT2QxZXFFRWlYUWoyUG4zRVBIZGc6MQ"" rel=""nofollow"">https://spreadsheets.google.com/viewform?formkey=dFZkT2QxZXF...</a><p>View the Results: <a href=""https://spreadsheets.google.com/pub?key=0Ataf_IejHzNydFZkT2QxZXFFRWlYUWoyUG4zRVBIZGc&output=html"" rel=""nofollow"">https://spreadsheets.google.com/pub?key=0Ataf_IejHzNydFZkT2Q...</a><p>This is the harder-to-troll version, which i'll be posting on HN shortly.",0,10
